{
  "schemaVersion": 1,
  "protocolVersion": 1,
  "input": {
    "schemaVersion": 1,
    "workType": "code",
    "surfaces": [
      "config"
    ],
    "risks": [
      "untrusted-input"
    ],
    "platforms": [],
    "behaviorChange": true,
    "executableChange": true
  },
  "primary": "clean",
  "guides": [
    "clean",
    "test",
    "security"
  ],
  "reasons": {
    "clean": [
      "WORK_CODE",
      "CHANGE_BEHAVIOR",
      "CHANGE_EXECUTABLE_CONFIG"
    ],
    "test": [
      "WORK_CODE",
      "CHANGE_BEHAVIOR",
      "CHANGE_EXECUTABLE_CONFIG"
    ],
    "security": [
      "RISK_UNTRUSTED_INPUT"
    ]
  },
  "excluded": {
    "premium": [
      "NO_PRIMARY_WORK_TYPE"
    ],
    "design": [
      "NO_UI_SURFACE"
    ],
    "performance": [
      "NO_MEASURABLE_PERFORMANCE_RISK"
    ],
    "accessibility": [
      "NO_UI_SURFACE"
    ],
    "games": [
      "NO_PRIMARY_WORK_TYPE"
    ]
  },
  "contractFingerprint": "24c485842d0915b22906b64b9c6c9e5ad444b5882a52ff1f9b92c5b49390ffe5"
}
